{
  "sourceFormatVersion": 1,
  "manifestVersion": 3,
  "id": "dawnlight:dawnlight_v3_1",
  "name": "Dawnlight v3.1",
  "version": "3.1",
  "description": "Dawnlight external shader pack.",
  "shaderRoot": "shaders",
  "settings": "manifest/ui/settings.json",
  "fragments": [
    "manifest/options/clouds.json",
    "manifest/options/shadows-terrain.json",
    "manifest/options/compatibility-water.json",
    "manifest/options/lighting.json",
    "manifest/options/effects.json",
    "manifest/options/post-screen.json",
    "manifest/resources/composites-terrain.json",
    "manifest/resources/scene-targets.json",
    "manifest/resources/point-lights.json",
    "manifest/resources/ocean-wave.json",
    "manifest/resources/cubemap.json",
    "manifest/resources/shaft-lighting.json",
    "manifest/resources/transparent-copies.json",
    "manifest/resources/shadows.json",
    "manifest/passes/cloud-deferred.json",
    "manifest/passes/composites.json",
    "manifest/passes/frame-services.json",
    "manifest/passes/shadows.json",
    "manifest/passes/terrain-base.json",
    "manifest/passes/terrain-transparent.json",
    "manifest/passes/atmosphere-shaft.json",
    "manifest/passes/output.json",
    "manifest/programs/cloud-atmosphere-lighting.json",
    "manifest/programs/post-process.json",
    "manifest/programs/shadows-terrain.json",
    "manifest/programs/ocean-point-lights.json",
    "manifest/programs/scene-drawables.json",
    "manifest/programs/atmosphere-effects.json"
  ]
}
